{
  "schema_version": "1.0",
  "submission_id": "LL-DEMO-0001",
  "created_at": "2026-08-29T08:00:00-07:00",
  "suite": { "id": "fleet-skill-matrix", "version": "2" },
  "harness": { "name": "Hermes", "version": "1.0.0", "profile": "lokislab-fixed-v1" },
  "system": {
    "computer_description": "Mac mini with Apple M2 Pro and 16 GB unified memory",
    "os": "macOS", "os_version": "15.6", "architecture": "arm64",
    "cpu": "Apple M2 Pro", "gpu": "Apple M2 Pro integrated GPU", "memory_gb": 16
  },
  "model": { "runtime": "Ollama", "name": "gemma4", "version": "12b-it-qat" },
  "configuration": { "type": "publisher_recommended", "settings": {}, "notes": "Default config." },
  "runs": [
    { "test_id": "4a", "category": "infrastructure", "run_number": 1, "capable": true, "skipped": false, "quality": 5, "accuracy": 5, "speed_seconds": 30, "total_wall_seconds": 30, "raw_output": "Output from a public benchmark task.", "notes": "ok", "tested_at": "2026-08-29T07:45:00-07:00" },
    { "test_id": "4a", "category": "infrastructure", "run_number": 2, "capable": true, "skipped": false, "quality": 5, "accuracy": 5, "speed_seconds": 29.4, "total_wall_seconds": 29.4, "raw_output": "Output from a public benchmark task.", "notes": "ok", "tested_at": "2026-08-29T07:48:00-07:00" },
    { "test_id": "4a", "category": "infrastructure", "run_number": 3, "capable": true, "skipped": false, "quality": 5, "accuracy": 5, "speed_seconds": 30.7, "total_wall_seconds": 30.7, "raw_output": "Output from a public benchmark task.", "notes": "ok", "tested_at": "2026-08-29T07:51:00-07:00" }
  ]
}
